    نام رئیس جمهور روسیه چیست؟,پوتین,کفش,دمپایی,جوراب!
نام رئیس جمهور آمریکا کدام گزینه است؟,او با ما,او با شما,او با من,او با همه
نام رئیس جمهور کره شمالی کدام است؟,کیم ایل سونگ,بستنی ایل سونگ,فالوده شیرازی ایل سونگ,سونگ ایل یخمک!
در کتاب سال اول دبستان کبری چه تصمیم مهمی گرفت؟,تصمیم گرفت با هیچ کسی دوست نشه!,تصمیم گرفت ادامه تحصیل بده,تصمیم گرفت خود کشی کنه,تصمیم گرفت  انگشت خودشو توی دیوار سد فرو کنه !!
نام نخست وزیر فعلی اسرائیل کدام است؟,بنیامین نتا نیا هو,بنیامین بتا بیا هو,بنیامین نتا برو هو,هو بنیامین نیا برو گم شو !!
نام نخست وزیر بریتانیا کدام گزینه می‌باشد؟,آنتونی چارلز لینتون بلر,آنتونی نپتون چارلز بلر,آنتنی  بلر چارلز لینتون,آنتونی لینتون چاراز دلر
تعداد حلقه‌های المپیک؟,5 عدد,6 عدد,7 عدد,8 عدد
